{
  "$schema": "./quiz-questions.schema.json",
  "schemaVersion": 1,
  "title": "BuildBench Wissenstest",
  "testSize": 20,
  "questions": [
    {
      "id": "q001",
      "category": "Arbeitsschutz & Montage",
      "question": "Welche Funktion gehört zu „ESD-Armband“?",
      "hint": "Potentialausgleich statt Isolation",
      "options": [
        {
          "id": "A",
          "text": "gleicht elektrische Potenziale kontrolliert aus und schützt empfindliche Bauteile vor elektrostatischer Entladung",
          "feedback": "ESD-Armband: gleicht elektrische Potenziale kontrolliert aus und schützt empfindliche Bauteile vor elektrostatischer Entladung."
        },
        {
          "id": "B",
          "text": "erfordert Herunterfahren, Ausschalten des Netzteils und Ziehen des Netzkabels vor internen Arbeiten",
          "feedback": "Diese Funktion gehört zu „Spannungsfreiheit“. „ESD-Armband“ bedeutet: gleicht elektrische Potenziale kontrolliert aus und schützt empfindliche Bauteile vor elektrostatischer Entladung."
        },
        {
          "id": "C",
          "text": "vermeidet direkten Kontakt mit Kontakten, Leiterbahnen und empfindlichen Bauteilen",
          "feedback": "Diese Funktion gehört zu „Anfassen an Platinenkanten“. „ESD-Armband“ bedeutet: gleicht elektrische Potenziale kontrolliert aus und schützt empfindliche Bauteile vor elektrostatischer Entladung."
        },
        {
          "id": "D",
          "text": "halten die Platine vom Gehäuseblech fern und dürfen nur unter vorgesehenen Schraublöchern sitzen",
          "feedback": "Diese Funktion gehört zu „Mainboard-Abstandhalter“. „ESD-Armband“ bedeutet: gleicht elektrische Potenziale kontrolliert aus und schützt empfindliche Bauteile vor elektrostatischer Entladung."
        }
      ],
      "correctAnswer": "A"
    },
    {
      "id": "q002",
      "category": "Arbeitsschutz & Montage",
      "question": "Welche Definition passt zu „Spannungsfreiheit“?",
      "hint": "Verbindung zum Stromnetz beachten",
      "options": [
        {
          "id": "A",
          "text": "vermeidet direkten Kontakt mit Kontakten, Leiterbahnen und empfindlichen Bauteilen",
          "feedback": "Diese Funktion gehört zu „Anfassen an Platinenkanten“. „Spannungsfreiheit“ bedeutet: erfordert Herunterfahren, Ausschalten des Netzteils und Ziehen des Netzkabels vor internen Arbeiten."
        },
        {
          "id": "B",
          "text": "erfordert Herunterfahren, Ausschalten des Netzteils und Ziehen des Netzkabels vor internen Arbeiten",
          "feedback": "Spannungsfreiheit: erfordert Herunterfahren, Ausschalten des Netzteils und Ziehen des Netzkabels vor internen Arbeiten."
        },
        {
          "id": "C",
          "text": "halten die Platine vom Gehäuseblech fern und dürfen nur unter vorgesehenen Schraublöchern sitzen",
          "feedback": "Diese Funktion gehört zu „Mainboard-Abstandhalter“. „Spannungsfreiheit“ bedeutet: erfordert Herunterfahren, Ausschalten des Netzteils und Ziehen des Netzkabels vor internen Arbeiten."
        },
        {
          "id": "D",
          "text": "verhindert durch Kerben und Formen falsches Einsetzen; ein Stecker darf nicht mit Gewalt montiert werden",
          "feedback": "Diese Funktion gehört zu „Steckercodierung“. „Spannungsfreiheit“ bedeutet: erfordert Herunterfahren, Ausschalten des Netzteils und Ziehen des Netzkabels vor internen Arbeiten."
        }
      ],
      "correctAnswer": "B"
    },
    {
      "id": "q003",
      "category": "Arbeitsschutz & Montage",
      "question": "Welche Aussage beschreibt „Anfassen an Platinenkanten“ korrekt?",
      "hint": "leitende Flächen nicht berühren",
      "options": [
        {
          "id": "A",
          "text": "halten die Platine vom Gehäuseblech fern und dürfen nur unter vorgesehenen Schraublöchern sitzen",
          "feedback": "Diese Funktion gehört zu „Mainboard-Abstandhalter“. „Anfassen an Platinenkanten“ bedeutet: vermeidet direkten Kontakt mit Kontakten, Leiterbahnen und empfindlichen Bauteilen."
        },
        {
          "id": "B",
          "text": "verhindert durch Kerben und Formen falsches Einsetzen; ein Stecker darf nicht mit Gewalt montiert werden",
          "feedback": "Diese Funktion gehört zu „Steckercodierung“. „Anfassen an Platinenkanten“ bedeutet: vermeidet direkten Kontakt mit Kontakten, Leiterbahnen und empfindlichen Bauteilen."
        },
        {
          "id": "C",
          "text": "vermeidet direkten Kontakt mit Kontakten, Leiterbahnen und empfindlichen Bauteilen",
          "feedback": "Anfassen an Platinenkanten: vermeidet direkten Kontakt mit Kontakten, Leiterbahnen und empfindlichen Bauteilen."
        },
        {
          "id": "D",
          "text": "muss vor der Montage entfernt werden, damit Wärme zuverlässig an den Kühler übertragen wird",
          "feedback": "Diese Funktion gehört zu „Kühler-Schutzfolie“. „Anfassen an Platinenkanten“ bedeutet: vermeidet direkten Kontakt mit Kontakten, Leiterbahnen und empfindlichen Bauteilen."
        }
      ],
      "correctAnswer": "C"
    },
    {
      "id": "q004",
      "category": "Arbeitsschutz & Montage",
      "question": "Welche Funktion gehört zu „Mainboard-Abstandhalter“?",
      "hint": "Metall unter einer Platine",
      "options": [
        {
          "id": "A",
          "text": "verhindert durch Kerben und Formen falsches Einsetzen; ein Stecker darf nicht mit Gewalt montiert werden",
          "feedback": "Diese Funktion gehört zu „Steckercodierung“. „Mainboard-Abstandhalter“ bedeutet: halten die Platine vom Gehäuseblech fern und dürfen nur unter vorgesehenen Schraublöchern sitzen."
        },
        {
          "id": "B",
          "text": "muss vor der Montage entfernt werden, damit Wärme zuverlässig an den Kühler übertragen wird",
          "feedback": "Diese Funktion gehört zu „Kühler-Schutzfolie“. „Mainboard-Abstandhalter“ bedeutet: halten die Platine vom Gehäuseblech fern und dürfen nur unter vorgesehenen Schraublöchern sitzen."
        },
        {
          "id": "C",
          "text": "soll stabil, sauber, gut beleuchtet und möglichst nicht statisch aufladend sein",
          "feedback": "Diese Funktion gehört zu „Montagearbeitsplatz“. „Mainboard-Abstandhalter“ bedeutet: halten die Platine vom Gehäuseblech fern und dürfen nur unter vorgesehenen Schraublöchern sitzen."
        },
        {
          "id": "D",
          "text": "halten die Platine vom Gehäuseblech fern und dürfen nur unter vorgesehenen Schraublöchern sitzen",
          "feedback": "Mainboard-Abstandhalter: halten die Platine vom Gehäuseblech fern und dürfen nur unter vorgesehenen Schraublöchern sitzen."
        }
      ],
      "correctAnswer": "D"
    },
    {
      "id": "q005",
      "category": "Arbeitsschutz & Montage",
      "question": "Welche Definition passt zu „Steckercodierung“?",
      "hint": "Form und Ausrichtung prüfen",
      "options": [
        {
          "id": "A",
          "text": "verhindert durch Kerben und Formen falsches Einsetzen; ein Stecker darf nicht mit Gewalt montiert werden",
          "feedback": "Steckercodierung: verhindert durch Kerben und Formen falsches Einsetzen; ein Stecker darf nicht mit Gewalt montiert werden."
        },
        {
          "id": "B",
          "text": "muss vor der Montage entfernt werden, damit Wärme zuverlässig an den Kühler übertragen wird",
          "feedback": "Diese Funktion gehört zu „Kühler-Schutzfolie“. „Steckercodierung“ bedeutet: verhindert durch Kerben und Formen falsches Einsetzen; ein Stecker darf nicht mit Gewalt montiert werden."
        },
        {
          "id": "C",
          "text": "soll stabil, sauber, gut beleuchtet und möglichst nicht statisch aufladend sein",
          "feedback": "Diese Funktion gehört zu „Montagearbeitsplatz“. „Steckercodierung“ bedeutet: verhindert durch Kerben und Formen falsches Einsetzen; ein Stecker darf nicht mit Gewalt montiert werden."
        },
        {
          "id": "D",
          "text": "darf nicht weiterverwendet, geöffnet oder gequetscht werden und gehört in eine geeignete Rücknahme",
          "feedback": "Diese Funktion gehört zu „Beschädigte Lithium-Batterie“. „Steckercodierung“ bedeutet: verhindert durch Kerben und Formen falsches Einsetzen; ein Stecker darf nicht mit Gewalt montiert werden."
        }
      ],
      "correctAnswer": "A"
    },
    {
      "id": "q006",
      "category": "Arbeitsschutz & Montage",
      "question": "Welche Aussage beschreibt „Kühler-Schutzfolie“ korrekt?",
      "hint": "keine Transportschicht im Wärmeweg",
      "options": [
        {
          "id": "A",
          "text": "soll stabil, sauber, gut beleuchtet und möglichst nicht statisch aufladend sein",
          "feedback": "Diese Funktion gehört zu „Montagearbeitsplatz“. „Kühler-Schutzfolie“ bedeutet: muss vor der Montage entfernt werden, damit Wärme zuverlässig an den Kühler übertragen wird."
        },
        {
          "id": "B",
          "text": "muss vor der Montage entfernt werden, damit Wärme zuverlässig an den Kühler übertragen wird",
          "feedback": "Kühler-Schutzfolie: muss vor der Montage entfernt werden, damit Wärme zuverlässig an den Kühler übertragen wird."
        },
        {
          "id": "C",
          "text": "darf nicht weiterverwendet, geöffnet oder gequetscht werden und gehört in eine geeignete Rücknahme",
          "feedback": "Diese Funktion gehört zu „Beschädigte Lithium-Batterie“. „Kühler-Schutzfolie“ bedeutet: muss vor der Montage entfernt werden, damit Wärme zuverlässig an den Kühler übertragen wird."
        },
        {
          "id": "D",
          "text": "findet lose Stecker, Werkzeuge und Kabel in Lüftern vor dem ersten Einschalten",
          "feedback": "Diese Funktion gehört zu „Abschließende Sichtprüfung“. „Kühler-Schutzfolie“ bedeutet: muss vor der Montage entfernt werden, damit Wärme zuverlässig an den Kühler übertragen wird."
        }
      ],
      "correctAnswer": "B"
    },
    {